<?xml version="1.0" encoding="utf-8"?>
<xs:schema xmlns:xs="http://www.w3.org/2001/XMLSchema" elementFormDefault="qualified">
    <xs:element name="agenda">
        <xs:complexType> 
            <xs:sequence>
                <xs:element maxOccurs="unbounded" name="contacto">
                    <xs:complexType>
                        <xs:sequence>
                            <xs:element name="nombre_apellidos" type="xs:string"/>
                            <xs:element minOccurs="0" maxOccurs="2" name="telefono" type="xs:unsignedInt" />
                            <xs:element name="edad" type="xs:unsignedByte"/>
                            <xs:element minOccurs="1" maxOccurs="3" name="email" type="xs:string"/>
                        </xs:sequence>
                    </xs:complexType>
                </xs:element>
            </xs:sequence>
        </xs:complexType>
    </xs:element>
</xs:schema>